Text,Category
lap way um premature you know like just survived All Odds but she loved movies,
she was around when we told her that I'd gotten cast in this my grandma like she went and saw a taxi driver in the,
theater when it came out in the 70s you know like loved film and she CED at me,
like Shirley Temple I think a lot of Grandma's from the 30s you know it's like like I said Res Kids a lot of times,
like our our out our view of the outside world is first shaped by like Cinema but,
we told her like yeah I'm going to be in Martin Scorsese film Oh Martin scorsi,
with Robert dairo oh Robert DeNiro and Leonardo,
Dicaprio and then I pulled Titanic out of her collection oh that's amazing wait can I ask,
something really quickly now that we're all best friends and I want to steal all of your secrets um in terms of Duality,
I'm I'm so curious to know what you guys I think about comedy and drama like and,
that the the difference is and if you approach it differently how you think,
about that I I just right it's it's the,
hardest I think really hard it's like super hard but I heard this thing I I,
just heard Matthew mccon and I don't I don't know if we're allowed to bring up men but here but I heard him say this,
thing about how he approaches drama like a comedy and comedy like drama which I thought,
was really interesting um and I I feel like I'm getting asked this a lot in,
terms of like how do I how do you like reconcile the two um genres and style,
and in terms of tone and pacing and I I just I'm curious if any if like what,
what do you think about that do you I do think comedy is harder definitely harder,
than than drama I feel less scared that I'm going to pull off like a big,
screaming crying scene than I am that I'm going to pull off a funny scene yeah like I'm like I know I can scream and,
shout and cry and do all that stuff but like can I make people laugh I don't know but I think it requires the same,
level of commitment that that like it's all in because if you take even an inch off the pedal there it's like going to,
fall flat on its face it's interesting that mccon quote though like that is kind of yeah I was thinking about like,
comedy being I mean comedy being tension and timing and and then thinking about,
the most dramatic scenes that that's also true that that inherent sense it's,
like a tickle that it's hard to explain but it feels for me the time it's time like comedic timing is so such a thing,
that I feel like you don't have to be quite so spot on with the timing when it comes to drama but I feel like you do,
and when I watch your work I feel that same sense of timing of tension timing,
of of it's almost like playing to a live audience where there's you because you,
are when you're in a when you're in a scene with someone you're in the same way as like a conversation with someone,
you're you're feeling out what is going to happen next what's coming from them,
like you were saying reacting you're yeah you're watching someone move and,
you're responding as such and in that sense I feel like comedy and drama are the same and life is constantly,
encapsulating both yeah like something that's just serious and never has levity does not make sense to me because when,
someone's dying you find a reason like everybody bursts into laughter because the tension's so high at a certain point,
or they like it it always lives in tandem yeah but I agree with you I think the timing is constant whether it's you,
know called comedy or drama it's always like Revelation I feel like in drama,
like the revelation of an emotion is where you get some of the catharsis and maybe the audience comes along for it,
and the same with a joke a revelation is almost like a punch line yeah speaking of timing we do have to wind down um is,
it something we said it is if this were up to me we would be here all day but I know that you can't do that um what is,
the most used emoji on your phone one good I think mine's the brain,
explosion one mine's the melting Smiley I love the melting Smiley it's really,
helpful and the smiley with the sunnies I do a lot too yeah mhm there's also one that's like that oh yeah I love that one,
what's this one mean the up circle like people go like this what does that mean I thought it's,
used in tandem with the X like it's an XO oh oh I feel adorable I don't know,
but there's also just an XO isn't there like X and an o i I never know what it means when you when you I like send a,
text to someone and they'll go just do it to them Ma like you're you,
made a goal I know or like I don't know or I have no idea I've become a fan of,
the sparkly the sparkly yeah the Stars like the three little stars that's that's a good frame coming around to,
head yeah it's like a good frer for the for the Jack it's a nice the Emoji is the art the Sparkles or the,
frame do it h let's do it h to you ladies thanks yall so so much Che,
cheers Che thank you very much for having us well that hour flew by but,
we learned so much guys I mean from P to a 5-year-old about what you really do for a living to the most used emojis on,
their phones wow oh that's right we also talked about acting too until next time I'm Ivan orgy and this has been off,
I think Final Cut Is is an attitude it's a state of mind I mean I wasn't going to be making films I was only making films,
I felt passionate about if I feel passionately about it then it's going to have to be yeah this way this way if you,
don't want to make this film don't make the movie but this is the movie I'm making you know if you do want to make it let's go you know financi Final Cut,
is a state of mind that is the t-shirt that is the T-shirt love welcome to offs script with,
The Hollywood Reporter I'm your host Ivan orgy here at the gorgeous Georgian hotel in Santa Monica California for,
years The Hollywood Reporter has brought the film industry's top creatives together for inspiring and surprising,
conversations and today is no different when it comes to film making from the very first action to the final that's a,
cut it's all about bringing the director's Vision to life and today you're about to hear from six Visionary,
directors who made some of this year's most talked about films that's right today we have Blitz bazle of The Color,
Purple Bradley Cooper of maestro AA duen of origin Greta Gerwig of Barbie Todd,
Haynes of May December and Michael man of Ferrari normally they're behind the,
camera but today they're on the record and just a little off script with The Hollywood Reporter hey Rebecca they're,
all yours thanks Ivon we're here with The Hollywood Reporter director's Roundtable how do you guys like to start,
do you actually call Action Greta what's your preferred way of diving into a scene um I guess I say when you're ready,
um it's I it seems less aggressive maybe I was directing,
said something more yeah you usually usually it's the sun's going,
down does anybody else like to like a more kind of action forceful no I would,
say action yeah I don't I don't even yell at on set like I the first ad does that like I,
just whisper and like and and and often I'm also like so nervous that I I don't,
want to like transfer that energy into so I just go somebody's job to just be The Confident one like I'm just going to,
be here looking at his monitor going please work I call Action um or I have action,
called it took me a long time in my film making to feel confident not to be the,
one calling action MH because you know I thought I need to be doing it and now I'll just tap my ad and he or she'll do,
it um but but I find it important to do because there's more than the actor who,
is working in that moment and that you need to call attention to everyone on the crew that we are now focused stop,
and now we're going to we're going to look here and so uh I like to do it what about you no I I I do it because I feel,
like the actors appreciate a moment of just Collective,
okay the energies can can align and we can all be in sync with each other you,
know but it it should be gentle of course do you what do you do brother well I think because uh I'm in the movie,
uh I have a a leg up in that way that I could I'm I have more S tools to create an environment so actually I have hand,
signals with the sound mixer and the camera operator and I I don't call Action and I'll sort of everything after,
everything's set up I'll just sort of start talking and bring the actors and often they don't they don't know rolling,
and then they're like the scene's over and they're like huh I sort of try to do that so it's and,
also I'm I'm the I'm Lenny so it's not like uh I'm not breaking in and out of character so I really it's really kind,
of I can I have a much more ability to like create this illusion you know so,
it's a it's it's uh it's easier so you stayed in character in between takes yeah so Leonard Bernstein was directing,
everybody leard yeah I mean I I would go I would show up with Kazu here the makeup artist at like one a and then,
Lenny would be done before crew call and then and then I would yeah it's Lenny all day dep and then he was different,
ages so the crew was like oh we got young Lenny it's going to be a quick day old Lenny it's like oh here we go he's,
going to walk from there to there you know it was it was crazy yeah I was so naked it felt like and I was the first,
day the first scene we shot was when old Lenny teaching William uh conducting and,
um but that was a great ice breaker because I just thought are they all gonna because I have to that was the first that yeah the first was the was,
the was the Jaguar pulling up that was the first actual setup and then we went inside and did that scene yeah oh my God,
so that was crazy and um it was baptism by fire and but I it was beautiful because I was so naked I I felt so,
vulnerable I remember really feeling like are the crew going to start laughing at me because I'm you know and they didn't and and really in that that,
first day we all sort of came together and I felt like it was just a beautiful like you know there's no I don't there's,
no chairs there's no video Village on the set so it's just everybody's right there and they don't leave and uh it,
just felt be it was like oh we're a troop yeah what how important is it choosing what your first um scene that,
you're going to shoot is how does that sort of set a tone what goes into the thinking Ava what was your what did you,
start with uh on Origin gosh I I remember about an hour into the first day I thought why why did I choose of,
course it was a matter of location availability and it just I I couldn't dictate it was a purely a logistics,
decision um but it was the day that I woke up that morning first morning,
Monday uh 400 a.m call uh for a thousand,
background actors to Hy Hitler oh God and I thought you know what let's just,
start it off let's just do this and so it was the morning and it just so much,
so many background actors that action that intention uh was the first thing we,
did wow and and in some ways the film is what it wants to be and and uh it set a,
tone for the uh the seriousness of the subject matter the intention with which,
we're going to work throughout the production and that oh this is really about something that we need to keep our eyes on for the whole crew I'm not that,
concerned with the first day I'm what I'm concerned with is when in the schedule I want to have the most pivotal,
and important Saints and so for me is that's usually around week four or five because regardless of how much we've all,
prepped you learn about making the film organically and emotionally intuitively,
as you go and so you know more about making this for for everybody those it's,
the scene when um when Enzo and Lara have their big blow up and then of course the last scene in the film which,
is which is key so I wanted those scenes to be in about week four I wanted to do,
all the car work in the beginning and get it out of the way so we could rink wrapped down into a smaller unit that's,
very organic and suit the dramatic seeds and of course it did not work out that way at,
all so we wound up doing all the dramatic seeds first and I I was going to say I thought you did the cars last,
right that's how that's why we W up doing the cars last and they were done quickly like everything in the mountains,
was shot in one day wow wow one day my God which was crazy that's crazy did you,
have many cameras going many unit like how did you do that yeah you talk very,
quickly W so yeah no we had no it was just one unit I have B I don't have I,
don't have second unit so I like split off in B camera sometimes we just did it's just very very planted everything,
was planned and know Greta what's the day that you were sort of moving toward,
was it was there a particular scene that you had in your head I I tend to like to shoot the beginning of the movie at the,
end because you you're not so tense about it I mean you know you you have some ease with it um,
but on this one we actually shot the whole beginning of it in the beginning,
and it was like a it was like a silent film that was unfolding because was the whole wakeup sequence and everyone was,
in their own strange houses and it was and it so it was like a week of like a,
silent movie um which was great because then there were lots of words after that,
um but every everyone became very in sync and everyone everyone on the crew it was everyone was like a dancer um,
sound and camera and everyone was that makes makes total sense because the opening is fantastic the camera just,
moves around you understand the entire culture of Barbie's World and um you,
know in just in one whole set of moves it was a it was it was a you know I'm,
everyone here it was a I had the most wonderful Dolly grip you know when someone is like they just and and he was,
best friends with Margot um I mean really their best friends so they had a short hand so he would know,
when she was going and then they could run at high speeds together later it was like a I was like this is every act lead,
actor should be best friends with a dolly grip this is a this is a critical thing and then you know Rodrigo was is,
so great with his team but I think so I start I started with the beginning and then I think um for us I think the thing,
that I I I wanted to hold to the end was actually sh in Los Angeles because,
everything about this movie was so absurd and heightened and I felt like we had to stay in this protective world as,
long as we could and um so then La went at the end which was correct there are,
so many moments where I'm amazed what you got away with um in a wonderful way and I was wondering if there are moments,
that you're amazed that you got away with yes there are many moments I'm amazed that I got away with there's just,
some very obscure your jokes which I can't believe are in the movie like a PR,
Barbie joke that's a really that was I don't know I heard one woman in New York laugh at that joke I thought oh about,
that's for you um there's a Steven malcolmus pavement joke which I was like,
that's a deep cut even you know and and things like that what there's a dream,
ballet of Ken's I things like that I it's there's a there's a ton of stuff in,
it you know when you make strong stylistic choices which is true of everyone at this table it's like you,
kind of have to get behind it 100% because you're like well I I guess I'm doing it this,
way I I don't have another way and then you think well maybe I should have covered myself too late now it's this,
and I think that that's like a but there's sort of freedom in realizing there's no way there's no you're just,
going to do like you're going to do it in one shot or this is going to go into is this dream sequel like there's these,
kind of moments where you're like I guess I've committed you know and a crew feels that yes yeah Todd there's a scene,
early in May December that feels to me like it really defines the tone for the movie and I'm sure people have asked you,
about it when Julian Moore opens the fridge and says there's not enough hot dogs and you have this dramatic zoom and,
the score changes I just want to know what what were you thinking in terms of setting the tone and and particularly,
about that scene well that scene sets up this whole barbecue sequence when,
Natalie Portman is coming to for the first time to introduce herself to the woman she's gonna study to play in a in,
a film um but the thing that I was thinking about when every was talking about their first days is the music that,
we used in the film was in inspired by a Michelle gr score from uh Joseph losy,
film The go between from 1971 incredible film that's sort of,
fallen out of circulation not something you see much in the United States very,
hard to even get on DVD I saw it on TCM When I Was preparing my image book for May December and I knew May December,
needed a very strong tonal frame uh to sort of create this sense,
that you're really questioning what you're watching all the way through and it entices the viewer into that,
discomfort of H feeling the ground shift beneath you which is really what happens throughout the,
film and so I thought okay this music is We also had we had 23 days to shoot the,
movie in Savannah Georgia wow so everything had to be so meticulously planned and it meant though that it was,
like what you were saying you bring everybody in to this adventure these,
risks that you're taking as a director these choices that you're taking as a director but it doesn't work unless you're all that's right sharing that,
concept so that music the score from that film became my example of what I,
wanted to do with the score very bold very in-your-face score that sits right in front from the very beginning and so,
the very first setup we did just Natalie bortman driving up to the community center where she does a flower,
arrangement scene with Julian and um right away I was like hit,
it Ben my assistant and all of a sudden we go d d this music and the whole crew was like,
wait what is what movie are we making and we played the cues to this,
other score through the entire shooting of the movie but it put us all in the,
same tonal space you know and then it was ultimately something I I had to have,
my composer adapt but that scene with that with just a Sting from that score,
that marks that moment with the refrigerator sets up a a tonal MH you know freedom I think a relaxation that,
there's going to be humor against this very dark story but I try to have the music ahead of time and because become,
become as you're talking about kind of a poetic modular and so what is this scene about again a certain emotional quotient,
that I can't put in the words and if you have one piece of music for a pivotal scene for the whole thing for me that's,
kind of a kind of a poetic modular for something and I try to have it head of time that's no surprise for how the,
music works in your from the very beginning Blitz I I heard you say that,
when there was first discussion of making the color purple as a movie your thought was why but obviously you,
ultimately became persuaded what was it that persuaded you well it was actually,
going back to Alice Walker's words you know her brilliant pit prizewinning book and those first words the God you know,
for me were like the the anchor cuz immediately I understood that whoever writes led us to God has an imagination,
period and then I kind of started to break through that and go well if they have an imagination how wide can we push,
this idea of this imagination and the throughout the challenge was how do you not be,
redundant you know for for a a piece of material that's been this explored and,
and and we all know all its minations what are you actually going to contribute so that was my big Challenge,
and so once I found this idea of this imaginative space then it became about,
what are the elements that are going to help us explore them better and some of them were visual some of them were Sonic,
um but also I also kind could think about myself and go you know when I,
think about people who are have dealt with trauma and abuse you know they often miscategorized this you know being,
docile or waiting to be saved I think nothing could be further from the truth it's really people who are in their,
heads trying to figure out how to work their way out and so and I grew up around many people like this you know,
some in my family right and so I knew very quickly that you know that pathway was going to open up so much opportunity,
for us to actually contribute to the cannon and and I'm so thankful that I,
was allowed to push forth um I remember our very first day was our our two girls,
netti and and cely and I wanted to begin there because I wanted to begin in a,
space of innocence and a place of Beauty for for the whole cast you know just to,
go and then the crew to go whatever happens here whatever Darkness we're going to kind of go through we're going,
to find light at the end you know and so we begun with this beautiful wide epic of like Savannah Driftwood Beach it's,
like gorgeous the sun's out and we do this amazing mov and the craziest thing,
the first shot of the first day is in the movie you know I mean which that's which is rare you know but but it was it,
was so we was all so ready and we were we all wanted to just live in this beautiful world that these girls were,
going to go in and how it'll turn dark but know that we're going to find our way back out of it so yeah I mean once,
that day was over I was just like I can exhale I feel like I feel like I know what I'm doing I feel like I can handle,
this scope and uh yeah it just just kept going from there Ava the book that,
Origins based on is this incredible um sort of Scholastic book cast by Isabelle,
werson it is not in any way an obvious cinematic adaptation to me when I read it I maybe would have seen a docu series,
you went a whole other way with it where did you get the idea to to frame it the way that you did well I read the book,
The First Time and didn't understand it and that frustrated me I read it again,
and I started to kind of get a feel for it and by the third time I read it I thought people need to know this,
information and i' had done 13th before and had considered doing it as a docu series but I know that um the the,
characters they started to call to me because there are characters within this non-fiction book uh embedded in the,
historical tales that the author shares one I talked about my first day was all,
of these background act actors highing Hitler the way reason we staged that scene is because there was one man,
August landmesser who refused to Hile and I thought oh I want to know more about his life and so there's nothing,
else about him so I had to research that shoot that put it on its feet and bring actors in to flesh out his life and the,
life of his his spouse and so those characters throughout history that the author references um I wanted to animate,
them with real life with flesh and bone on them but also when you're thinking about the structure I said is this crash,
is this like a bunch of stories kind of together that touch a bit just,
tangentially um or could I find a character that delivered it to us and um,
when you read the book really closely you see Isabelle the author she's speaking in her voice she is discovering,
she is the delivery system and when I researched her even further she lost people in her life within a 16-month,
span while she was writing the book now that's a character and that is someone that I want to get to know someone that,
I feel empathy for someone that I want to deliver this information for us and so so um it's an unadaptable book um and,
uh that's always the kind of books you want to adapt um that's that's kind of the things I go for but you know it was,
uh a film that I feel every film that I made up until this point led me to it,
had historical aspects that I had I had uh practiced in Selma has blurs the line,
between documentary and narrative which was the 13th was a big part of that when they see us dealing with the sprawling,
cast and and and a bunch of different different story lines there's a a,
quality with Isabelle's character where she's often having to persuade skeptical people about her book and I wondered if,
there was any of you in that in having to persuade skeptical people about your idea yes yeah did I say I made it,
independently yes um yes yes it really was I mean this isn't the kind of film,
that you take to a studio and say can you give me millions of dollars to make a story about a woman who's going through a trauma and through that trauma,
writes a book about very dense subject matter that she believes will save Humanity um there's no actual enemy or,
antagonist the antagonist is all of us like that pitch meeting doesn't go well at the studios um and so we just didn't,
do it we just decided to take that off the table and not ask for something that,
I already knew you know not ask may I cast and new Ellis may I may I cast her,
will you accept that I cast this woman that you do not think is going to bring in butts and seeds can I populate this,
with the actors that I love and not that are on your list you know can I I want,
to go and shoot in Delhi I want to go to Berlin we only have 37 days I know that,
but I'm going to do three countries in 37 days you know the kinds of things that the studios will just it just does,
not happen they won't allow it and so sometimes you just don't ask and so that,
that that's what we did so there wasn't a lot of nose and also I I just surround myself with people who saw me reaching,
for something and who supported that you know there was one friend of mine who I,
leaned on so heavily in this his name is gal Del Toro he got me through this I,
