Text,Category
swapping Let's Make a Deal let's make a anybody want to ratify this come on we,
have you all okay last two if you had not become an actor what would you be doing today,
oh my gosh I don't know I wanted to be an animator but I don't know yeah I,
that's what I wanted to yeah I know that's what I wanted to do but talk about something that's even harder than this,
and is even more crazy but I did want to be an animator whether I would have been I don't know but that's what I wanted to do I tried but it didn't work out I got,
into Johnson and Wales uh to be a chef actually that's what I wanted to be I,
really thought you I still I'm I think I'm a really really good cook I feel like I'm a good cook and I'm a great good host but also I want to be you I,
want to be this guy but it's funny already I'm thinking like that third Act of my life I feel like I want to,
investigate architecture I'm just an architecture nerd and I'm always thinking maybe I go back to school and,
learn that and do that when I'm like 70 you know I don't know yeah I started taking art classes of sculpture classes,
at the art students league in New York City I recently yeah and I love that and I um it gives me a lot of what I get,
from this and if that was a possibility I would throw that would be a good,
second act you know or teaching nice I'd love to teach maybe robertt if I wasn't,
an actor I would be doing a hard,
time I want know what crimes he would have committed though I trumped up felony possession again but I this this,
time it was on a Hummer these cops set up but still jury you know,
whatever judge got pissed off bench warrant oh [ __ ] I was the same guy from the other stuff so Ed a,
cumulative Ed it's really weird there's a there's a theme my mother was an art teacher on when I got my first film when,
I was 17 on exactly the same day it was a little Irish film on exactly the same,
day I won this burer to educate myself as a as a painter for like five years a big burer and I chose [ __ ] show,
business so i' go but you would do that I would definitely do that because it's so,
frustrating now I don't know if you do do you I don't painting yeah it's really it's really hard because if you don't,
exercise those muscles you lose them it's so frustrating but that's what I do that's what I do yeah uh you know I mean,
I I started acting my junior year college I was a political science major you I grew up in DC what else you going,
to do um my mom was a lawyer for the government um so that was the idea and,
probably if I weren't doing this I'd be a lawyer maybe I don't know maybe a a,
criminal lawyer I'd be I'd be uh i' be Robert I'd be your father I'd be I'd be,
defending now you can make a,
career it's a growth industry well guys on on behalf of The,
Hollywood Reporter thank you so much,
for all right so I feel like we learned a lot from today's round table first order of business please keep Robert,
Downey Jor GL as an actor because of the alternative not so great until next time,
I'm Ivan orgy and I am openly single and this has been off script with The Hollywood,
Reporter oh thank you have you been here the whole time,
I was like if you pair like when you pair Spielberg with Dinosaurs what do you get a billion dollars you pair Greta,
and barie I'm going to make a billion dollars you I was like God I hope this works out,
hey everyone welcome to off scri with The Hollywood Reporter I'm Ivon orgy and we are here at the georan a Historic,
Hotel in Santa Monica California now as you know The Hollywood Reporter brings the industry's biggest and brightest,
stars to together for legendary conversations and guess what today is no different we are about to hear from six,
actresses who were in some of this year's most talked about films from the billion dooll Blockbuster that caused a,
pink paint shortage you know what I'm talking about it's Barbie to Martin scors say three and a half hour intermission lless epic but guys it was,
worth every minute that's right killers of the flower Moon so strap in use the restroom now you have been warned and,
let's get ready for a beautiful conversation between Anette Benny ly,
Gladstone Greta Lee Carrie Mulligan Margot,
Robby and Emma Stone they are on the record but maybe,
just a bit off script with The Hollywood Reporter take it away Rebecca thanks ion,
hello and welcome to the Hollywood reporters actress Roundtable let's dive in how would you describe your job to a,
5-year-old playing pretend yeah playing pretend I remember playing pretend I,
once heard an actress talk about this and I kind of was like oh God that sounds like a little kind of I don't know corny but you know what I remember,
playing pretend really well I remember the feeling of like how deep can I get in it I'm the frontier woman in the,
backyard grinding berries that was one of my faves and and playing Mommy I,
actually used to play with dolls but yeah playing pretend and it is a it is a,
grown-up version of that Greta how would you explain I lie to them and and I I,
have two children who are seven and four um but I mean all kidding is I mean I,
it's it's one of those things where I I I tell them it's the most important job in the world and I'm saving lives um,
there's doctor and there's me um no I think um and this is something that,
becomes more true I think just aging um and wanting to,
appreciate just the The Burning Desire the the love of something and to and for,
me specifically telling my kids I love this and um for them to get to see it I,
think has been really just wonderful and sometimes very difficult because they,
don't understand all of it um but it is it's that shared love of the thing you,
know and sometimes it is hard to put into words so sometimes then you lie Annette I had heard that when you,
were on niad you would tease jod Foster like right before the director's called action is that true I probably I hadn't,
thought about that but I mean I do goof around a lot I kind of helps me relax sometimes it sort of depends because,
some people don't really enjoy doing that and so you have to be careful there are some actors who are actually,
serious no but looking at me uh no I do do that sometimes to just,
to keep things loose and you know you go in with a lot of uncertainty and uh you,
want that right you want it's like planned uncertainty you want to try to find something that surprises you and,
maybe your partner Jodie is such a fine actress that I felt so lucky you know,
because uh acting is reacting and listening and just taking from the other person so yeah I probably did do that I,
like to have a good time I like to you know goof around Emma I know yorgos lanth Theos is sort of known for doing,
these um exercises and games and stuff with actors when they're in rehearsals,
did you do that on poor things was it helpful what what kinds of things we I was out there about a month before we,
started shooting and we did three about three weeks of rehearsal which was similar to the amount of time we had on,
the favorite and it's wonderful because you none of it is literal like you're not blocking out the scenes or or going,
through the lines and the way that you know it will happen on camera so you're doing like games where you're all kind,
of tied get I mean it's true theater games like you know or or like everyone has to shut their eyes and walk around,
and one person is assigned to put a chair under them as they sit like you you know it's just completely silly so,
you embarrass yourself in front of each other and then you kind of get really close really quickly so by the time,
you're on set you feel like you know each other really well and it's just like you can experiment and be free and make fun of each other and it's you know,
no um kind of eggshell experience with your other actors which is really really,
helpful other people have like something similar a way to just sort of quickly get intimate and get comfortable on a,
set anything that's worked for you just so validating like hearing that from both of you you know I'm I'm a goofball,
on set and I tend to play really serious roles and my Foundation is in theater so a lot of these games it's a fun job I,
mean obviously there's like I'm saying it's fun and then I saw Killers over the flower Moon I'm like it's it's,
fun obviously there's so like really really you know heavy emotional very,
important stories that are being told but if you can find the sort of like,
levity or at least that to to me it feels like you were saying like it feels so good to kind of have that levity in,
between because acting yeah is fun like it's a you're playing pretend forever,
and a lot of that stuff I mean in theater and in like film is just not feeling like a complete tit when you get,
you know like to feel like okay you're not going to think I'm first of all terrible at this or you know like and I,
feel that from like I need to feel that with the crew as well like I need I need the DP to think I'm not like I need,
you know so I need to I feel like the best case scenario is when you get there and it's your act your your director,
your co- actors but also the crew are all like MH you can't be bad and then,
you're in a good place but is that takes away the self-awareness a little bit when like you're Happ everyone feels,
like they're making the same thing yeah and that's one of the great things about film is I feel like when you're in theater it's such an actor's game yeah,
yeah it's so it's like Sumer Camp should should feel like completely but it also helps when you're shooting things like,
you know like you said it's and I've said it to everybody that was on set we have no business having this much fun,
making this film but it's also there were so many Native actors and so many Native crew and Extras and when we're,
together like I mean Indians just laugh you know which I think helped with,
sustaining some of the importance of it because you're surrounded by a this is the community that's being impacted and,
this is that makes the tragedy stronger I mean we've got that dual mask for a reason I feel like I kind of need the,
goofy to like springboard into the the drama sometimes completely otherwise,
you're just like the heaviness of it is excruciating yeah I don't know what you,
guys are talking I am dead serious High art that work it's not a joke am,
I ising to you guys didn't have any Barbie was not fun I bet it was not fun,
how did you like how did you how did you recover at the end of the day it was I know I lost,
myself was there an onet therapist for you did you have people call you Barbie,
I mean off camera I mean the funny thing is in our script everyone was because everyone's Barbie and everyone's Ken,
everyone's name was in the script so I'm Barbie Margo says to Ken,
Ryan and Barbie Issa says to you know like so all it's weird seeing your name in a script when you're reading it,
you're like isn't it kind of amazing how it's become like a sort of Sisterhood greeting now where you just people you,
see people go hey Barbie like that's just how we don't know I had a friend who's like running on the beach and wearing something pink just by chance,
and someone was like hi Bobby and they like they yelled back hi Bobby they like I'm in it now,
how did you how did you think about how Barbie would move like what her physicality would be that was really fun,
and obviously Guided by Greta but me yeah welcome she she knew it how serious,
Al set needed to be like I no um yeah it was I love physical comedy and I like my,
favorite era of film is like the 30s when it's like all head to toe acting like you know cuz the frame is so head,
to toe and it's all yeah it's I love scre bble comedies and I love that so I've always been,
excited to have the chance to do very physical comedy but it was also like the the line between I wanted there to be an,
evolution between how she moved and spoke from the beginning of the film to the end of the film and it shouldn't be,
obvious to the audience but the it should by the end of it you should be like oh yeah I'm looking at someone who's being a doll and then by the end,
of it you're like I think I'm watching Margot like I I wanted to kind of by the,
end have morphed into being human without people realizing and we did that in a number of ways um you know like the,
wig started off with like tons of volume and hair and then got smaller smaller shorter shorter until it looked more,
like normal natural hair and the costumes went you know I spoke to jacine I was like okay she's got to have very,
certain like shapes and a lot of structure and like definite colors definite patterns everything should be,
constructed and then as we go by the end the fabric should be soft the pattern,
should be messy but still feminine and like so we did you know things like that and then with the physicality and you,
know I would just kind of went from being very certain to kind of Uncertain by the end in a good way so I wanted you,
know my speech patent to be at the start like I'm having a dance party that's going to be a song that's going to be this you should come by and by the end,
you know the way like when we talk in real life you have like hesitation and you stumble on words or like you leave a,
gap before you say the next thing because you're trying to think of it so I wanted to have a speech by the end to have that quality to it and at the,
beginning to just be very certain no hesitation I can't even remember what,
your question was she was just asking like what are you doing we didn't need a sounds,
awesome like sit that transition was so fun to watch,
though like watching that gear shift and just the human emotions starting to sink,
in I mean I think a lot of us needed that after the last several years I I,
felt that on set too like people were so excited to be back on set again and like,
yeah it's like we all went for it even more because we were even more great like I think I'm always so grateful that,
I even get to make movies but you just felt that everyone was like oh my God we get to make movies again so everyone,
really wanted to go for it and barie kind of like that setting in the environment gr created was very lent,
itself to going for it and and really like being in and joyful and so silly I,
mean everyone was so silly in front of each other all the time and yeah it was amazing it was so fun it was like yeah a,
NeverEnding dance poy Greta hearing Margot talk about the language change in Barbie made me think of your working in,
both Korean and English in past lives how much Korean did you know when you got that part how much did you have to,
learn um I was I was terrified that I was going to mess up the Korean I grew,
up speaking Korean but it's not I think it's I don't know it's something it's hard to explain unless you you are,
bilingual um it's like I'd forgotten that I could speak Korean because of the life that I was living um in America you,
know so right away that was something that was going to be very vulnerable for,
me and exposing um but I guess I like to do this thing before I start a job where,
I kind of make this informal list of um I guess I can just call them like challenges that lie ahead I like to make,
it tangible because so much of what we do is so internal and this list for past,
lives was we're shooting on 35 millimeter I've never done that before it was my first time playing the lead,
role after 20 years of working and I didn't know how to do that I I I'd never,
done that before um and you know we were shooting in New York City it was a time,
span of 12 Years years of playing different ages um and the costumes there,
was nowhere to hide I I'd come from doing a lot of heightened characters where I could use the the makeup or the,
the clothing to yeah I I I had none of that and then at the very bottom of this,
list was the Lang was Korean speaking almost entirely in Korean um was almost,
like the jacket on top of all of these other concerns um which maybe was helpful in,
the end but it's it's a huge responsibility to accurately portray,
these certain nuances of what it's like to be to have that Duality that cultural Duality and I did a lot of funny things,
where I asked instead of a conventional dialect coach who could kind of give me,
the perfect South Korean accent I asked for this incredible woman uh Sharon Choy,
who you guys might know you remember from maybe the,
Oscars thing with her she could translate in the moment,
Jokes which to me was something that is required yeah actual genius no offense,
you're a genius too but she I know you're so but I really needed to find,
somebody who could understand it's it's similar to what you're talking about trying to show this whole spectrum of,
this Human Experience but this range that isn't sort of wiped clean um and,
made sort of flat and I needed to find specifically someone who could help me,
um even within one scene the way she starts out sound sounding after years of not speaking Korean that she would sound,
kind of like a white girl and maybe after hours of talking to her childhood sweetheart in Korean that she would,
sound more Korean and and what that means in showing that whole range so I,
was I felt really so relieved to find her and and to yeah to have her as as a,
tool hearing you talk about that you had played heightened characters reminded me I've heard you say growing up you were,
watching characters played by like M Kilmer and Nick Cage and that that's what you envisioned for yourself and it,
kind of makes me wonder what did everybody watch growing up and see you,
know a version of what they assumed they would play or what they hoped they would play did anybody have a particular,
performer or type of performance in their minds I watched a lot of horn,
films again that physical comedy I think I just really enjoy great comedian,
really does her whole body with it and yeah yeah I feel compelled to explain,
the vomer no I see it I see it thank you we're always up for the same stuff bow,
give me a shot I feel like like growing up I felt,
fiercely competitive but not with other women with men yeah and there was this,
quality growing up of seeing certain kinds of actors and performers like Val,
like Nicholas Cage these sort of like Jack Nicholson these very athletic um,
kinds of performances that as the little girl that I was I was jealous and I I,
wanted that and and then later of course that that evolved as I grew and you know,
I and then I was attracted to other kinds of performances like Charlotte rampling or Maggie Chong or but that's,
that's that was how I started off um because it felt like some sort of benign,
resistance like some sort of like I don't like as a little girl to be to say like no I want I wanted that I wanted to,
be Daniel de Lewis yes I like I Saw The Crucible and I was like I want to play I don't want to play the I play his part,
like that was the the best part and and he was the best yeah is the best pH hman,
and Kate Blanchett if I can diffuse the two of them into one those are my two,
perfect actors really um I mean childhood Inspirations it's pretty out there now I,
wanted to be an Ewok and that's what started all this madness really,
legit literally and I haven't let it go yeah maybe feel like we,
would y a lot of body compression work I think I can do it um no yeah but you,
said Margo you wanted to play the boys always yeah yeah that's what kind of,
spawned your production company right like the men always had the best parts in this every time I read it I was like,
the mail roll I was like nope we got to make it so you read the female role and you're like she's got the best scenes,
she's got all the the moment she's got it Annette what about you well I I didn't see a lot of movies,
as a kid um I did see Sound of Music so I love that movie and I love Julie,
Andrews when I got to be a little bit older like when I was in community college and I started doing because I,
started doing theater and I just when I was in high school and I just loved doing plays and then I was going to this,
dollar a unit Community College that just happened to have a great theater Department,
so I started doing plays I remember seeing at the little Art House theater in San Diego I remember seeing,
Persona um that was the first time I had seen something like that believe Olman,
BB Anderson so that she began to really intrigue me leave Olman of course great,
actress made all of those amazing films with igar Bergman um and I began to get,
interested in that I didn't really start thinking about doing movies till I was old a bit older but um I certainly,
admired Vanessa Redgrave she was one of my big heroes um there was something about her,
quality too um that I really admired um,
yeah and I just I just did plays for many years and so then I didn't really start until I was almost 30 to do movies,
so I didn't kind of grow up with that mentality of thinking about it um you,
know I just didn't I just couldn't imagine it kind of but I would see a great movie and then I would think,
oh wow that's so powerful to see a great movie like loving it and thinking well I,
guess somebody has to be in them I remember having that thought somebody has to try somebody has to be out there,
saying maybe could it be me Emma I was thinking about your,
character Bella in poor things usually when I ask an actor about a role I I'm thinking what did you have to learn what,
did you have to prepare and with Bella I thought what did you have to unar,
because you're basically playing a child in in your grown-up woman's body so how,
did you how did you even start with that um it was jorus and I talked about,
about Bell for a long time we he told me about the book and sort of the adaptation that he and Tony were working,
on Tony magnam who wrote who wrote the favorite and also cruel so it was my third time working with,
Tony by the time we by the time we made po things and um he he basically gave me,
the outline and then we talked about it for four years so I didn't read a draft,
for like two years so it's just sort of started to I guess I've never had a a,
project go on that long or sort of sit with me for that long so I think it started to just sort of like through,
osmosis I would think about um aspects of it but because she's in a a full,
grown healthy body you know it's not like even you could compare it to like,
someone who's been in an accident and lost their memory and is relearning how to walk or how to move that wasn't,
really comparable and then also looking at you know videos or ideas of like toddlers beginning to walk their bones,
are still growing and they're still forming so she doesn't have that so we,
tried to just sort of map her physicality as much as possible but in a way that it was really amazing because,
there was nothing to compare it to it was completely just kind of like we just experimented with things and he' be like,
no that's that's insane and I be like I know try this one Whatever but insane good but,
insane s what do you insane like okay um but so we I mean the two of us really,
just kind of talked about it for for years and then uh and same with her kind of evolution in language and how she,
develops and you know what words she does or doesn't say how she refers to herself or other people she's just my,
favorite character of all time because of that unlearning,
she's totally without shame she's pure,
joy and curiosity and experimentation and adventure and has no qualms about,
her body or her you know experience or food or drink or you know the way she,
relates to other people it's so it was so inspiring to me on a daily basis and it was really like I just I I miss her,
all the time because she was so she's so alive um and so open to to life that it,
was like a very it was a very inspiring person to get to try to be every day or,
to live up to um did you ever feel embarrassed or like would do something,
where you like a part of your brain were like oh my God I look like an idiot right now or do you just get there and you're like,
completely similarly to what you were just saying I love I love physical comedy too I love the sort of and it you,
know and neos's films are are you know dark comedies but they're definitely,
comedy so it feels like growing up for me My Heroes were Gilder Rader Molly Shannon like I was watching SNL growing,
up so like that was my that was my like Pinnacle I you know I loved that world,
so much so I think that that sort of goofiness or or what would be embarrassment is so sort of I don't know,
freeing I find that so so much fun and like I don't I don't do not take myself,
seriously in any way so people like laughing at something I'm attempting to do doesn't really bother me but I also,
it's a testament to working with a director that you truly truly trust,
admire believe in and know is the captain of the ship in a way that you can be you can really let go cuz cuz I,
think we've probably all worked in experiences where you feel like you also have to be the captain and you don't,
fully trust that you can do it all or throw it all out there because you don't know what exactly they're seeing or how,
they're going to bring it together which is a really difficult at least to me because I don't,
want to direct I it's really difficult to sort of like have to think in two minds of like well if this if I give you,
this option take you're going to use it I know you are and I don't want do that so I have to whatever to not,
feel that at all which I don't with Yos I feel like whatever we try I'm like I know he's going to go with whatever is,
best for the film is like the greatest totally thing you know um and did you,
work with like a movement coach or like how did you come up with the phys it was just him and I we just sort of like in,
