Text,Category
I know we made a good piece of Television like I know that and I know it wasn't because of the budget it was,
because of the story it was because of the heart it was because of of the commitment to it and so you don't need,
to make a movie for $670 million for it to be good I know that for a fact and,
and a lot of us come from that that truth thank you hey welcome to offs,
script with The Hollywood Reporter I am your host Ivan orgy here at the Georgian Hotel hotel in Santa Monica California,
today we are serving up some hot takes with six aess actors from some of this year's award contending,
films you're about to hear from Coleman Domingo of Rustin Robert Downey Jr of,
Oppenheimer Paul Giamatti of the holdovers Mark Ruffalo of poor things,
Andrew Scott of all of us strangers and Jeffrey Wright of American,
fiction they are on the record but just little off script with The Hollywood,
Reporter over to you Scott thank you Ivon it is truly a pleasure to have with,
us these six actors who did such outstanding work in 2023 films and I want to begin by establishing the fact,
that there are a lot of connections at this table some of which the general public is well aware of some of which,
even you guys yourselves may not know because these started early in your career so I'm going to just mention a,
few movies and if the people people who were part of these hear stuff I don't want to,
hear 1998 25 years ago Mark Ruffo and Paul Gatti you were both in safeen do we have,
any memories of that nice stash bro that's it that's the best the movie,
there you go now that same year 25 years ago Paul Giamatti and Andrew you Andrew,
Scott were both in Saving Private Ryan how is that even possible yeah I was the guy in,
green I loved him nice work oh [ __ ] I didn't even know,
I didn't know that either because we were together subsequently 10 years after that the,
same two gentlemen John Adams sure John Adams I was the guy in the powdered way that's now Mark Ruffo and Jeffrey Wright,
almost 25 years ago angle Ride With the Devil any memories of of that that true story yes I lied about being able to,
ride a horse I remember I remember very vividly walking past you you were tied to a,
fence post if I'm not mistaken that's right Beautiful Beginning I Remember Now Paul you and,
Coleman Domingo in 2013 all is bright oh yes yes legendary all is,
bright that old CH that really yeah wow it's a Christmas movie it's very dark,
yeah now Paul and Jeffrey dark Christmas movie both in Lady in the Water 2006 and,
the eyes of March 2011 wow so there may be some uh memories there,
everything okay you're like the American Michael Kan can you speak to that now Robert and,
Mark here at the end of the table it started with 2007's zodiac and then,
there was a whole bunch of movies slow uh company called Marvel I believe you guys were together were you in that oh,
wow yes after I convinced you that's true though right you were lobbying for,
Mark to do it I wouldn't be here today without you really in so many ways and,
finally I will note that this year not only uh is Coleman Domingo terrific in,
rusting but so is Jeffrey right so there's two right up through the present it's our first time working together,
that's crazy really yeah so you're not only here because of your great work but you're also here of your great work in,
the project he's I'm just following,
Coleman's got two two going now we're going to get into these 2023,
performances of each of you but um I want to First go back and ask each of you about sort of a a pivotal Turning,
Point a decision in your career that maybe laid the groundwork for the uh eventually having a year like you had in,
2023 and Robert maybe we can start with you your late father who you made this,
wonderful uh documentary senior both with and about he was a pillar of the indie film Community you started out,
very much in the Indie art housee uh scene but there was this moment when,
you're approached by Marvel about Iron Man because of your background in indie film did you have any hesitation about,
taking them up on that so my dad raised me in this environment of to be growing,
up was to be making movies and then doing this documentary about him and,
then my Mrs who produced it with Chris Smith having the tenacity to tell me that I had to follow through with it and,
not try to do a puff piece at all because our our history was so complicated that was really a big,
turning point and then shortly after that Nolan called so you never know what happens when you realize if you deal,
with the things in your life that are so small but so important it kind of opens gateways for the stuff that we think as,
important you know or maybe perceived as important you've said and I'm going to quote quote back to you I was raised in,
a that rebelled against the idea of a summer blockbuster having any Merit I'm happy that I regained my connection with,
a more purist approach to making movies most recently with with Oppenheimer but before I mean just this idea of stepping,
into that world was it jarring no because anyone who knows John favro knows that he is I mean I remember,
seeing swingers and just that monologue he has and I was like and he wrote this I was like who is this guy because there,
was no real assurity that this was even going to take off Iron Man was like second tier hero they kind of let the,
lunatics run the Asylum for a little while and we so it was a completely an indie approach to a a genre movie to,
begin with but I've seen that in all the films this year there's this thing happening I would say particularly this,
year where I feel like many of us are afforded this opportunity to kind of like there's a little subversion within,
the accessibility that I so appreciate Coleman let's go back if we can to I,
believe 2005 you're in newor York away from where your family was based friends,
I think you're bartending struggling to find acting work and you decide to sort of take matters into your own hands,
right what can you tell us about oh wow this onean show that really sort of turned things around man I well I was a,
a bartender at a bar in the West Village called the 55 bar I would do whatever,
play that I can do and then run across town and finish my start my shift at 9:00 and go until 4:00 in the morning,
and then when I wasn't working I was writing and I was trying to create something for myself because you know,
just you just a frustrated artist and um between like when things when things would clear out about 1:00 in the,
morning I was writing and I was putting on music and I was sort of writing about what was happening in my life both my parents were suffering from different,
illnesses and they lived in uh Virginia and I was just you know still just trying to you know figure things out I,
lived in a terrible situation illegal sublet and everything so I was just you know hustling New York story it's such a,
New York story oh yeah so I started writing and I started writing what was going on and about the music I was,
putting on I I really still can't to this day remember if stories came first or the song came first but I was putting,
this thing together that eventually I I'm one of those people like if you give me a space I will figure out something,
to do so the owner said um hey Coleman I want to do some theater some projects on Sundays you have anything I'm like yeah,
let me try this stuff out so I would do weird things like serve fried chicken and put on music and it's weird I would,
make it like sort of like a salon and then I would I would read these pieces and so I read them and then friends of,
mine was say I think what is it I'm like is it a play what they're like I think it's a solo show you're the event and you have to follow this through I,
started working with that and I worked with the director and it became a show called a boy in a soul when it started,
out it was about like how music was helping me to find different moments and anchor me in certain things and part of,
sort of keeping your records keeping your soul your song music then eventually my parents passed away they,
passed away while I was finishing this uh they both passed six months apart and the show was the thing that became the,
gift that kept on giving I found I found my voice I feel like as a as a writer and I started perform performed at the,
vineyard theater in New York and and in London and in Australia and it really gave me more grounding of like who I was,
and what I could do and so I really created this thing where I played my family members myself and all that and,
and it felt like it's something that I wanted to be in conversation with with audiences like how how do we do it how,
do we move through grief how do we build when there's nothing but it really I don't know then I was solidifi as a,
playwright in New York and um people started to see me as the artist that I was because I've always been a character,
actor and so I would play seven characters literally at one time so so so that was fun and wonderful and it,
really gave me some new footing for my career um and then it's the thing that I think is the greatest gift that I,
learned from that is to create something uh not only for myself but for others so if like it gave me more agency in this,
industry and you you worked at the 55 bar yeah we we we might have done some work together prior to ruson and I spent,
a lot of time at the 55 I was bartending there I was there for for four years lot of good music there a lot of great music,
there yeah Andrew the math doesn't add up because I don't know how it's possible you're making movies 25 years,
ago you look so uh youthful great yeah I,
came but I think it makes the it hammers home the point like this is I think there certain people who flipped on,
season 2 of flea bag and it became this phenomenon the the hot priest and they,
thought this is like a a new guy uh you'd been doing this for a while and I wonder when that moment happened where,
suddenly there's unprecedented levels of interest in you how did you handle it personally and then also in terms of,
choices because you could have uh probably done more things than ever before in that moment how did you decide,
what to do I don't know I've always found like I started out really young I was 17 or 18 when I was at the ABY the,
National Theater in Dublin and I don't whatever it was when I was very young I remember being offered a,
part after I'd done maybe two plays and I was only a little skit of a thing and,
I was like I don't really want to do that and I was I think I was still living at home so maybe I felt like I,
don't want to do that again and quite early on I suppose this word is courage go I don't want to just play the same,
note if I don't have to because it always seemed to me that what's of value to you is to be able to play as many different kind of notes as as as you,
could and so all the time where I wasn't sort of more what's the word I suppose,
recognizable I never felt like I was failing really I was always just so delighted to be to be working,
and then I suppose when you get a bit more choice I never really think that I was I'm kind of was winning or you know,
wasn't really that particularly different except I do think there's a kind of thing that I think a lot of,
actors have which is a sort of quiet thing where you I love that thing that that Merill Street says and she's a,
Great Hero Of Mine which is to sort of pack your own suitcase you know that even if you're not getting the,
opportunities that you decide what you're going to put in your suitcase and even if someone isn't asking you to go,
on holidays you got your little bag you got it there and you go and so when some an,
opportunity comes up you go I recognize them I've packed for that slightly and and I think I think I think it's it's a,
kind of it's a beautiful thing isn't it and and uh and I I suppose then you just have a thing inside and you just go I don't want to do the same thing again,
and that's it is it's a cliche but I do think that's our biggest power is we to say no I'm just not going to do that,
again for those for the wrong for the wrong reasons so it was beautiful don't get me wrong but I don't know to try and,
keep it keep it keep it level Paul long before American Splendor sideways,
Cinderella Man John Adams private life billions all the stuff that you know many people know and love you for you're,
a a guy recently out of the ale School of drama you've done from Broadway and then the film,
opportunities you were making the most of them but I don't imagine that at the,
beginning the dream was if I may just remind uh Pig vomit in private parts or,
an orangutan in uh in the Planet of the Apes when for you oh that was a dream,
that was a no that was that was a that was the strange fulfillment of a deep dream seriously to be an orangutang to,
be an ape and Planet of the Apes it was was if that had been it for me I would,
be I would die happy well this is where I could believe I was going to be able to play a talking arang T and my agents,
were like don't you want to be a human so they can see your face and I was like if you tell them I want to be a human,
I'm going to burn the agency I was like who wants to be the,
human in Planet of the no that was a huge like you know and then what was the,
role that was in your mind kind of the the thing that I'm sure maybe you had,
something like it in your mind when you're going through the training that I've just talked about I actually think,
I mean you say pig vomit and you laugh but it's like I that was such a,
crazy being fired out of the craziest cannon in the world it was I couldn't,
believe I was being allowed off the chain like that you know I just been in a drama school where it was like I was,
it was very confining and and it always felt terrible confining I mean look at me man I'm not like a Shakespeare guy,
and stuff like that I I tried but I I felt very confined a lot of the time and,
I got out and I got this opportunity to do something it was absolutely bananas,
and it was like there was no top on the thing it was it spoiled me in a lot of ways because I thought oh this is what,
this is like doing a movie is can actually be like because Betty Thomas I mean we rehearsed a lot she was,
incredibly caring it was like the camera guys were wonderful Howard stern was,
great I mean he was lovely and it was like and I got to do the dumbest accent,
in the world and like there was nothing I could just go bananas so I felt really,
freed coming out of something and I just it felt theatrical too she made all,
literal space so you could just get Huger and Huger and crazier and crazier and it was just fantastic wow yeah well,
Jeffrey uh you start out really uh on most people's radar probably with Angel,
in America winning Tony for that on Broadway you come out with basat in your,
first film role and within about 5 years though you have said that your attitude towards basically the business if we can,
generalize really had changed and your priorities the things that you were,
interested in doing as an actor as a person totally got upended can you just explain cuz it does seem from the way,
you've talked about it that there was a before and after what happened this is what I've learned and we spoke about this a little earlier,
this is the thing that I have come to Value above all other things in in this,
stuff that we do and it's the collaboration it's the people that that I have the opportunity to do it with I,
learned that because early on there were some collaborations that uh you know,
might have been uh uh better diplomacy,
throughout and it's you it comes with u you know with the territory in terms of the lessons that you're you know you're,
required to learn and eventually you get through it but yeah there were some you know where I'd walk into a place and go,
yeah o this is not my beautiful house you know this is not what I expected you know when you talked about being in this,
environment that was supportive and that was creative and spontaneous and that it was like I found myself a couple of,
times in some really what I thought were very cynical places and I think the way that I kind of um was able to articulate,
it at the time was that these were places that rooms that aspired to be,
dumber than what was possible within the room and I was like oh wow man this is,
kind of weird um yeah kind of pulled back but also there were other priorities and other considerations that,
you make in terms of what you want to do like you know oh wow there's a human being that was just born into my life,
you know and a lot of work in Africa uh there was a lot of work that I yeah that was a part of you know let me you know,
it kind of Drew Me In I was trying to find something else that was um I had interests going back to you know college,
in um in in in issues that were related to the work that we were doing and so I kind of got drawn in and and it but it,
felt very creative at the same time in fact the first time that I went to Africa though speaking of grounding which is kind of related to what we're,
doing here was when I went to the Venice Film Festival um with bosot in 96 and I,
was like oh man okay this is all this stuff and you know this here's the here we guys said so I said to uh I said to,
the producer at the time I said okay fly me to Sagal fly me to dhar cuz I've never been to Africa I've never been to,
Europe before so fly me to darar and I'll meet you in Venice in a week you know so that that place was always there,
I kind of wanted to like kind of invade Europe like a Moore or something like that so there was always that you know there was always that Temptation and I,
think maybe always a bit of the suspicion of you know some of the the trappings of what we do you know um it's,
a much simpler thing at its core but it's surrounded by things that sometimes are not so simple mark it sounds like,
you had your own period of kind of questioning things around 08 09 2010,
where as you put it you pretty much had had it with acting and shed a lot of the,
things that agents and representatives of All Sorts what was going on that made,
you step away and then what made you I think with the kids are all right come back,
in relation to what um Jeffrey was talking about was you know there's you have your dreams um of it and then those,
start to become realized but they're not what you thought it was going to be at some point you know it gets away from,
you and next thing you realize is like you're it's the all about the business and someone's idea someone else's idea,
of your career that really didn't have much to do with what your idea idea was,
and then you lose what your idea was of what your career was going to be and I,
was already feeling that way and then my brother passed away and I uh it passed away just before,
I was going to direct a film um that I've been working on for a long time and,
during the course of that I was like I don't know if I want to go back to acting I kind of feel more much more,
comfortable here in this place you know just the the WTH of creativity that,
opened up to you as a director you're working with all the you know the department heads you're working with,
music you're working with movement you're working with the camera you're it was just it was like a feast of um,
creativity I got a great part the kind of part of movie that I I wanted to do,
and I was like this is going to be my last acting gig and it was the kids are all right and I was just like [ __ ] it,
I'm going to do whatever I want here I I'm I don't there's no rules anymore more I don't have to be anybody for,
anybody else and so I just kind of just did what I wanted with it and it was,
really freeing feeling and we went to Sundance and I had my the movie I directed premiered and then two days,
later the kids are all right premiered and I was sitting in that,
audience and I was like this experience is so honest this movie is,
about something so important at a coming into the world at a moment you know about gay marriage when all of these,
people were voting on gay marriage and it was saying you know we're the same and and there's no difference between,
straight marriages and gay marriages and it did it in a funny way that was just a human story that people could all relate,
to and I heard it in the laughter like the laughter tells you everything you know the laughter and the silence right,
and I heard everyone laughing whether they were straight or gay or whatever the religion was their,
background everyone were all laughing at the same thing and I was like that's what I want to do that's that's why I,
came here and then no one was like hey do you want to make another movie you want a five picture movie deal as a,
director and so I like um I oh I found my way oh there's a there's a little a,
little glimmer of a the path go there go there young man go,
there and that was kind of yeah having talked a little bit about the foundations that may have uh somewhat,
shaped the the decisions regarding these 2023 performances let's get into those,
and Jeffrey you work very selectively which is a that's a great thing and so I,
wonder though here's a guy CT Jefferson who's a terrific TV writer succession,
the good place one and Emy for Watchmen who says he wants to make his feature,
directorial debut how does a firsttime filmmaker convince you to sign up to,
collaborate with him in this case to play uh a college professor who has been,
told that the reasons his books are not selling is because they are not quote unquote black enough and then decides to,
try to write one that is I believe the book that is based on persal ever Sera,
talks with this idea about him the narrator hating WR hating stories that are about writers as he writes the story,
cord had taken that book and adapted it into this script that he gave me and uh,
yes uh uh you know it's a story about a writer it's a story about someone who uh,
does all of those things you you said but it was first it was like really just,
beautifully drawn the architecture was like so sharp you know it was clear that cord knew his way around a story but,
what really drew me in wasn't like kind of that like for me first level stuff I,
mean it's glittering it's it's it's satirical it's great for me it was the the story of this man,
who's all of a sudden burdened with the responsibilities of family I mean you guys have talked about you know how,
these things affect my mom passed not too sure not too long before I got that,
script and so it was uh you know the caretaking yeah of the one who was once,
caretaker that for me was what the story um how the story resonated that's what,
like plucked me I said I know that story I know that man and I know the difficulties and the sacrifices that,
that asks not only like creatively professionally but also personally and,
you know I can play that music and may you know maybe it'll be helpful to me,
and maybe and maybe uh you know someone else I don't know but um yeah it's not,
all the you know it's not it was just that and also I think in some ways that that is the most subversive aspect of,
the film because it really is a portrait that I'd never been asked to play Within,
before a portrait of a goofy mad you know dysfunctional at times,
functional loving frustrated but together family that happens to be black,
it's you know it's a family that's what that really is what the neon is pointing,
to that's the meal for me so you know yeah it was easy to say yes,
to that nice uh Paul it's been 19 years since you and Alexander Payne made the,
terrific movie Sideways I know there had been conversations about maybe doing other things over the intervening years,
but here we are he comes to you with the holdovers in which you're playing this,
boarding school teacher cranky guy who is made further cranky by having to,
spend the holiday break with a a grieving cafeteria worker and a and a,
grieved student was the fact that it was Alexander coming back uh and asking you,
to do this enough or did was there something um particularly about this character where you said I'm,
particularly gungho to do this well yeah I mean him coming back and saying I want to work again was pretty good I mean I,
would have done pretty much anything for the guy but he was showing me this script as it was coming along and he,
said you know I'm writing this thing for you and I kept saying he smells like fish he's got sweaty Palms he's got a,
crazy eye you know and all of that I was saying all of that all of that's wonderful and it was great and you know,
but he kept saying and I've been thinking about it you know he was writing this for me it was an extraordinary thing to be able to work,
with a friend and the story had a lot of resonances for me but that I think he,
knows about cuz he knows me and so it was something I was drawing in a deep well well of my past which almost made I,
was saying made me feel like it wasn't work in some strange way but I I think,
the thing that I thought was really amazing about it was it's a Christmas story it's genuinely A Christmas Story,
and because it's about selflessness ultimately these people all act selflessly towards each other so they,
can take a next step towards something it doesn't get resolved because he doesn't make movies that resolve very easily you know and it's like we don't,
know what's going to happen but they get a little bit forward but I thought this guy was very interesting it was very familiar to me to see this person who,
constructed this incredibly elaborate Persona you know and he's got all of these ideals and he's he's put together,
this whole kind of [ __ ] shtick you know and to watch somebody start to drop,
their stick but what's great about his movies is the mask goes away but it doesn't totally go away and it's so,
